course_name,question_desc,option_a,option_b,option_c,option_d,correct_option,difficulty_level,chapter_name,subject_name,
CA CPT QT,"If: <table border=""1"" cellspacing=""0"" cellpadding=""0""> <tr> <td width=""91"" valign=""top""><p>x&nbsp;&nbsp;&nbsp;&nbsp;&nbsp;&nbsp;&nbsp;&nbsp;&nbsp;&nbsp;&nbsp;&nbsp; :</p></td> <td width=""44"" valign=""top""><p align=""center"">- 2 </p></td> <td width=""35"" valign=""top""><p align=""center"">3</p></td> <td width=""43"" valign=""top""><p align=""center"">1</p></td> </tr> <tr> <td width=""91"" valign=""top""><p>P (x)&nbsp;&nbsp;&nbsp;&nbsp;&nbsp;&nbsp; : </p></td> <td width=""44"" valign=""top""><p align=""center"">1/3</p></td> <td width=""35"" valign=""top""><p align=""center"">&frac12;</p></td> <td width=""43"" valign=""top""><p align=""center"">1/6</p></td> </tr></table><br> then find E (2x + 5)",7,6,9,4,1,2,Probability and Expected Value by Mathematical Expectation,Quatitative Aptitude,
CA CPT QT,If A and B are two independent events and P(AUB) = 2/5; P(B) = 1/3. Find P(A).,2/9/2016, 1/3,2/10/2016,1/10/2016,4,2,Probability and Expected Value by Mathematical Expectation,Quatitative Aptitude,
CA CPT QT,A bag contains 12 balls of which 3 are red 5 balls are drawn at random. Find the probability that in5 balls 3 are red.,3/132,5/396,1/36,1/22/2016,4,2,Probability and Expected Value by Mathematical Expectation,Quatitative Aptitude,
CA CPT QT,"A random variable X has the following probability distribution: <TABLE border=1 cellSpacing=0 cellPadding=0> <TBODY> <TR> <TD vAlign=top width=55> <P>X</P></TD> <TD vAlign=top width=34> <P align=center>0</P></TD> <TD vAlign=top width=51> <P align=center>1</P></TD> <TD vAlign=top width=51> <P align=center>2</P></TD> <TD vAlign=top width=39> <P align=center>3</P></TD></TR> <TR> <TD vAlign=top width=55> <P>P(x)</P></TD> <TD vAlign=top width=34> <P align=center>&nbsp;0</P></TD> <TD vAlign=top width=51> <P align=center>2K</P></TD> <TD vAlign=top width=51> <P align=center>&nbsp;3K</P></TD> <TD vAlign=top width=39> <P align=center>K</P></TD></TR></TBODY></TABLE><BR>Then, P (x&lt;3) would be:",1/6/2016,1/3/2016,2/3/2016,5/6/2016,4,2,Probability and Expected Value by Mathematical Expectation,Quatitative Aptitude,
CA CPT QT,"P(A) = 2/3; P(B) = 3/5; P(A<span style=""font-family:Symbol; font-size:12.0pt; color:black; "">È</span>B) = 5/6. Find P (B/A)",11/20/2016,13/20,13/18,None,2,2,Probability and Expected Value by Mathematical Expectation,Quatitative Aptitude,
CA CPT QT,"If P (A<span style=""font-family:Symbol; font-size:12.0pt; color:black; "">Ç</span>B) = P (A) x P (B), then the events are:",Independent events,Mutually exclusive events,Exhaustive events,Mutually inclusive events,1,2,Probability and Expected Value by Mathematical Expectation,Quatitative Aptitude,
CA CPT QT,E (XY) is also known as:,E (X) + E(Y),E (X) E (Y),E (X)  E (Y),"E (X) <span style=""font-family:Symbol; font-size:12.0pt; color:black; "">¸</span>E(Y)",2,2,Probability and Expected Value by Mathematical Expectation,Quatitative Aptitude,
CA CPT QT,In a pack of playing cards with two jokers probability of getting king of spade is,4/13/2016,4/52,1/52,1/54,2,2,Probability and Expected Value by Mathematical Expectation,Quatitative Aptitude,
CA CPT QT,"Consider two events A and B not mutually exclusive, such that P(A) = ¼, P(B) = 2/5, P(A<SPAN style=""FONT-FAMILY: Symbol; COLOR: black; FONT-SIZE: 12pt"">È</SPAN>B) = ½ then <IMG src=""C:\Documents and Settings\harshals\Desktop\Teacher application\AppImages\13 Probability and Expected-1_clip_image002.png""> is",3/7/2016,2/10/2016,1/10/2016,None of the above,4,2,Probability and Expected Value by Mathematical Expectation,Quatitative Aptitude,
CA CPT QT,"If x be the sum of two numbers obtained when two die are thrown simultaneously then P (x <SPAN style=""FONT-FAMILY: Symbol; COLOR: #000000; FONT-SIZE: 12pt"">³</SPAN> 7) is",5/12/2016,7/12/2016,11/15/2016,3/8/2016,2,2,Probability and Expected Value by Mathematical Expectation,Quatitative Aptitude,
CA CPT QT,E (13x + 9) = ----------.,13x,13E(x),13E(x) + 9,9,3,2,Probability and Expected Value by Mathematical Expectation,Quatitative Aptitude,
CA CPT QT,A dice is thrown once. What is the mathematical expectation of the number on the dice?,16/6,13/2,3.5,4.5,3,2,Probability and Expected Value by Mathematical Expectation,Quatitative Aptitude,
CA CPT QT,"If P(A/B) = P(A), then A and B are",Mutually exclusive events,Dependent events,Independent events,Composite events,3,2,Probability and Expected Value by Mathematical Expectation,Quatitative Aptitude,
CA CPT QT,"A bag contains 3 white and 5 black balls and second bag contains 4 white and 2 black balls. If one ball is taken from each bag, the probability that both the balls are white is ----------",1/3/2016,¼,½,None of these,2,2,Probability and Expected Value by Mathematical Expectation,Quatitative Aptitude,
CA CPT QT,"The odds in favour of A solving a problem is 5:7 and Odds against B solving the same problem is 9:6. What is the probability that if both of them try, the problem will be solved?",117/180,181/200,147/180,119/180,1,2,Probability and Expected Value by Mathematical Expectation,Quatitative Aptitude,
CA CPT QT,"Consider Urn 1:2 white balls, black balls Urn II : 4 white balls, 6 black balls One ball is randomly transferred from first to second Urn, then one ball is drawn from II Urn. The probability that drawn ball is white is",22/65,22/46,22/55,21/45,3,2,Probability and Expected Value by Mathematical Expectation,Quatitative Aptitude,
CA CPT QT,If P (AUB) = p(A). Find P(A∩B).,P(A).P(B),P(A) + P(B),0,P(B),4,2,Probability and Expected Value by Mathematical Expectation,Quatitative Aptitude,
CA CPT QT,"In how many ways a team of 5 can be made out of 7 Boys and 8 Girls, if 2 Girls are compulsory to form a Team.","2,646","1,722","2,702",980,3,2,Probability and Expected Value by Mathematical Expectation,Quatitative Aptitude,
CA CPT QT,"A bag contains 5 Red balls, 4 Blue Balls and 'm' Green Balls. If the random probability of picking two green balls is 1/7. What is the no. of green Balls (m).",5,7,6,None of these,3,2,Probability and Expected Value by Mathematical Expectation,Quatitative Aptitude,
CA CPT QT,The probability of Girl getting scholarship is 0.6 and the same probability for Boy is 0.8. Find the probability that at least one of the categories getting scholarship.,0.32,0.44,0.92,None of the above,3,2,Probability and Expected Value by Mathematical Expectation,Quatitative Aptitude,
CA CPT QT,"If 15 persons to be seated around 2 round tables, one occupying 8 persons and another 7 persons. Find the number of ways in which they can be seated.",15!/18!,<SUP>15</SUP>C<SUB><SMALL>7</SMALL></SUB> 7!/8!,7!8!,2. <SUP>15</SUP>C<SUB><SMALL>7</SMALL></SUB> 6!7!,4,2,Probability and Expected Value by Mathematical Expectation,Quatitative Aptitude,
CA CPT QT,"A coin is tossed 5 times, what is the probability that exactly 3 heads will occur.",5/16/2016,1/32,5/36,3/32,1,2,Probability and Expected Value by Mathematical Expectation,Quatitative Aptitude,
CA CPT QT,"In sampling, standard deviations are known as:",Expectation,Sampling Error,Standard Error,All of the above,3,2,Sampling Theory,Quatitative Aptitude,
CA CPT QT,"When every member in population has an equal chance of being selection, then that sampling is called ---------",Restrictive,Purposive,Subjective,Non-restrictive,4,2,Sampling Theory,Quatitative Aptitude,
CA CPT QT,"Except sampling error, other errors in sampling are:",Non sampling errors,Standard errors,Sampling fluctuations,All of these,1,2,Sampling Theory,Quatitative Aptitude,
CA CPT QT,Distribution formed of all possible value of statistics is called ---------.,Sampling Distribution,Classification,Tabulation,None,1,2,Sampling Theory,Quatitative Aptitude,
CA CPT QT,"In sampling, standard error is:",Standard deviation,Quartile deviation,Mean deviation,Coefficient of variation,1,2,Sampling Theory,Quatitative Aptitude,
CA CPT QT,If every 9th unit is selected from universal set then this type of sampling is known as:,Quota Sampling,Systematic Sampling,Stratified Sampling,None of these,2,2,Sampling Theory,Quatitative Aptitude,
CA CPT QT,The Standard deviation of the sampling distribution of a statistical distribution is a,Critical value,Biased estimate,Unbiased estimate,Standard Error,4,2,Sampling Theory,Quatitative Aptitude,
CA CPT QT,The sampling is said to be large sampling if the size of the sample is:,greater than or equal to 30,less than 30,less than or equal to 35,less than 25,1,2,Sampling Theory,Quatitative Aptitude,
CA CPT QT,The errors other than sampling error are termed as:,Response error,Non-Response error,Non-Sampling error,Type I error,3,2,Sampling Theory,Quatitative Aptitude,
CA CPT QT,Sampling fluctuations may be described as:,The variation in the values of a sample,The differences in the values of a parameter,The variation in the values of a statistic,The variation in the values of observations,3,2,Sampling Theory,Quatitative Aptitude,
CA CPT QT,A random sample of size 17 has 52 as mean. The variance is 160. The 99% confidence for the mean are:,"[42.77, 61.23]","[44, 58]","[49, 51]","[37, 18]",1,2,Sampling Theory,Quatitative Aptitude,
CA CPT QT,Which sampling provides separate estimates for population means for different purposes and also an over all estimate?,Multistage sampling,Simple random sampling,Systematic sampling,Stratified sampling,4,2,Sampling Theory,Quatitative Aptitude,
CA CPT QT,A random sample of 100 items taken from a large batch of articles contains 5 defective items. Set up 96 per cent confidence limits for the proportion of defective items in the batch:,"[0.013, 0.095]","[0.009, 0.085]","[0.005, 0.095]","[0.005, 0.071]",3,2,Sampling Theory,Quatitative Aptitude,
CA CPT QT,The criteria for an ideal estimator are:,"unbiasedeness, expectation, estimation and sampling","estimation, efficiency, expectation and sufficiency","consistency, efficiency, sufficiency and unbiasedness","estimation, consistency, efficiency and sufficiency",3,2,Sampling Theory,Quatitative Aptitude,
CA CPT QT,The permissible sampling error is required to determine sample size for:,Estimating a Proportion,Estimating a Mean,Both (a) & (b),None of these,3,2,Sampling Theory,Quatitative Aptitude,
CA CPT QT,"If the population S.D. is known to be 5 for a population containing 80 units, then the standard error of sample mean for a sample of size 25 without replacement is:",0.83,0.8,0.93,0.74,1,2,Sampling Theory,Quatitative Aptitude,
CA CPT QT,A researcher wishes to estimate the mean of a population by using sufficiently large sample. The probability is 0.95 that the sample mean will not differ from the true mean by more than 25% of the standard deviation. How large sample should be taken?,72,62,42,32,2,2,Sampling Theory,Quatitative Aptitude,
CA CPT QT,"In determining the sample size for estimating a population mean, the number of factors must be known is:",2,3,4,5,2,2,Sampling Theory,Quatitative Aptitude,
CA CPT QT,"When we have an idea that the error might be involved, we use:",Point Estimate,Interval Estimate,both (a) & (b),None of these,2,2,Sampling Theory,Quatitative Aptitude,
CA CPT QT,"In a marketing survey for the introduction of a new product in a town, a sample of 400 persons was drawn. When they were approached for sale, 80 of them purchased the product. Find 95% confidence limits for the percentage of persons who would buy the product in the town","[17.08, 24.95]","[15.25, 22.08]","[18.08, 23.99]","[16.08, 23.92]",4,2,Sampling Theory,Quatitative Aptitude,
CA CPT QT,"A sample of size 3 is taken from a population of 10 members with replacement. If the sample observations are 1, 3 and 5 what is the estimate of the standard error of sample mean?",1.02,1.92,2.37,3.01,1,2,Sampling Theory,Quatitative Aptitude,
CA CPT QT,"For a given sample of 200 items drawn from a large population, the mean is 65 and the standard deviation is 8. Find the 95% confidence limits for the population mean:","[67.11, 63.89]","[66.11, 63.89]","[68.11, 65.89]",None of these,2,2,Sampling Theory,Quatitative Aptitude,
CA CPT QT,An unbiased estimator:,Has the smallest variance among all estimator,Is always the best estimator.,Has an expected value equal to the true parameter value,Always generates the true value of the parameter,3,2,Sampling Theory,Quatitative Aptitude,
CA CPT QT,"A simple random sample of size 10 is drawn without replacement from a universe containing 85 units. If the mean 90 and S.D. 4 is obtained from the sample, what is the estimate of the standard error of sample mean?",0.1176,0.58,1.19,1.26,4,2,Sampling Theory,Quatitative Aptitude,
CA CPT QT,"A simple random sample of size 66 was drawn in the process of estimating the mean annual income of 950 families of a certain township. The mean and standard deviation of the samples were found to be Rs. 4,730 and Rs. 7.65 respectively. Find a 95% confidence interval for the population mean:","[4782.15, 4731.85]","[4728.15, 4731.85]","[4793.85, 4801.85]",None of these,2,2,Sampling Theory,Quatitative Aptitude,
CA CPT QT,The sample mean is:,An MVUE for population mean,A sufficient estimator for population mean,A consistent and efficient estimator for population mean,All of these,4,2,Sampling Theory,Quatitative Aptitude,
CA CPT QT,Which sampling adds flexibility to the sampling process?,Systematic sampling,Multistage sampling,Stratified sampling,Simple random sampling,2,2,Sampling Theory,Quatitative Aptitude,
CA CPT QT,"If n numbers are drawn at random without replacement from the set <img>15 Sampling Theory-1_image001.png</img> 1, 2, _m <img>15 Sampling Theory-1_image002_0000.png</img> then var <img>15 Sampling Theory-1_image004_0000.png</img> would be:",<img>15 Sampling Theory-1_image006_0000.png</img>,"<img>15 Sampling Theory-1_image006_0001.png""","<img>15 Sampling Theory-1_image008_0000.png""","<img>15 Sampling Theory-1_image010.png""",3,2,Sampling Theory,Quatitative Aptitude,
CA CPT QT,"For any unknown parameter, how many interval estimates exist?",1,2,Many,3,3,2,Sampling Theory,Quatitative Aptitude,
CA CPT QT,"If a random sample of 500 mangoes produces 25 rotten mangoes, then the estimate of S.E. of the proportion of rotten mangoes in the sample is:",0.03,0.01,0.09,0.023,2,2,Sampling Theory,Quatitative Aptitude,
CA CPT QT,"If it is known that the 95% L.C.L and U.C.L to population mean are 48.04 and 51.96 respectively, what is the value of the population variance when the sample size is 100?",9,11,12,10,4,2,Sampling Theory,Quatitative Aptitude,
CA CPT QT,The hypothesis which is tested for possible rejection under assumption that is known is:,Null Hypothesis,Alternate Hypothesis,Simple Hypothesis,Composite Hypothesis,1,2,Sampling Theory,Quatitative Aptitude,
CA CPT QT,A Population comprises of 20 members. The number of all possible samples if size 2 that can be drawn from it without replacement.,210,380,190,400,3,2,Sampling Theory,Quatitative Aptitude,
CA CPT QT,For an unbiased estimator which of these is not an absolute condition.,Efficiency,Sufficiency,Unbiasedness,Minimum variance,4,2,Sampling Theory,Quatitative Aptitude,
CA CPT QT,The method of sampling in which each unit of the population has an equal chance of being selected in the sample is,Random Sampling,Stratified Sampling,Systematic Sampling,None of the above,1,2,Sampling Theory,Quatitative Aptitude,
CA CPT QT,The hypothesis which is tested for possible rejection under the assumption that it is true is known as,Biased hypothesis,Alternative hypothesis,Null hypothesis,None of these,3,2,Sampling Theory,Quatitative Aptitude,
CA CPT QT,A selection procedure of a sample having no involvement of Probability is known as:,Purposive Sampling,Judgment Sampling,Subjective Sampling,All of the above,4,2,Sampling Theory,Quatitative Aptitude,
CA CPT QT,Standard Deviation of a Sampling Distribution is called --------.,Standard Error,Statistic,Parameter,None of the above,1,2,Sampling Theory,Quatitative Aptitude,
CA CPT QT,"If the standard Error is ½, and the parameter of Normal population given to the S.D. = 4 then, find the sample size?",1024,16,64,36,3,2,Sampling Theory,Quatitative Aptitude,
CA CPT QT,Sampling Fluctuations may be described as,The variation in the values of a statistic,The variation in the values of a sample,The differences in the values of a parameter,The variation in the values of observations.,1,2,Sampling Theory,Quatitative Aptitude,
CA CPT QT,The sampling distribution is,The distribution of sample observations,The distribution of random samples,The distribution of a parameter,The probability distribution of a statistic.,4,2,Sampling Theory,Quatitative Aptitude,
CA CPT QT,Standard error can be described as,The error committed in sampling,The error committed in sample survey,The error committed in estimating a parameter,Standard deviation of a statistic.,4,2,Sampling Theory,Quatitative Aptitude,
CA CPT QT,A measure of precision obtained by sampling is given by,Standard error,Sampling fluctuation,Sampling distribution,Expectation.,1,2,Sampling Theory,Quatitative Aptitude,
CA CPT QT,"As the sample size increases, standard error",Increases,Decreases,Remains constant,Decreases proportionately.,2,2,Sampling Theory,Quatitative Aptitude,
CA CPT QT,"If from a population with 25 members, a random sample without replacement of 2 membersis taken, the number of all such samples is",300,625,50,600,1,2,Sampling Theory,Quatitative Aptitude,
CA CPT QT,A population comprises 5 members. The number of all possible samples of size 2 that canbe drawn from it with replacement is,100,15,125,25,4,2,Sampling Theory,Quatitative Aptitude,
CA CPT QT,Simple random sampling is very effective if,The population is not very large,The population is not much heterogeneous,The population is partitioned into several sections.,Both (a) and (b),2,2,Sampling Theory,Quatitative Aptitude,
CA CPT QT,Simple random sampling is,A probabilistic sampling,A non- probabilistic sampling,A mixed sampling,Both (b) and (c).,1,2,Sampling Theory,Quatitative Aptitude,
CA CPT QT,"According to Neyman's allocation, in stratified sampling",Sample size is proportional to the population size,Sample size is proportional to the sample SD,Sample size is proportional to the sample variance,Population size is proportional to the sample variance.,1,2,Sampling Theory,Quatitative Aptitude,
CA CPT QT,Sampling can be described as a statistical procedure,To infer about the unknown universe from a knowledge of any sample,To infer about the known universe from a knowledge of a sample drawn from it,To infer about the unknown universe from a knowledge of a random sample drawn from it,Both (a) and (b).,3,2,Sampling Theory,Quatitative Aptitude,
CA CPT QT,The Law of Statistical Regularity says that,Sample drawn from the population under discussion possesses the characteristics of the population,A large sample drawn at random from the population would posses the characteristics of the population,A large sample drawn at random from the population would possess thecharacteristics of the population on an average,An optimum level of efficiency can be attained at a minimum cost.,3,2,Sampling Theory,Quatitative Aptitude,
CA CPT QT,A sample survey is prone to,Sampling errors,Non-sampling errors,Either (a) or (b),Both (a) and (b),4,2,Sampling Theory,Quatitative Aptitude,
CA CPT QT,The population of roses in Salt Lake City is an example of,A finite population,An infinite population,A hypothetical population,An imaginary population.,2,2,Sampling Theory,Quatitative Aptitude,
CA CPT QT,Statistical decision about an unknown universe is taken on the basis of,Sample observations,A sampling frame,Sample survey,Complete enumeration,1,2,Sampling Theory,Quatitative Aptitude,
CA CPT QT,Random sampling implies,Haphazard sampling,Probability sampling,Systematic sampling,Sampling with the same probability for each unit.,4,2,Sampling Theory,Quatitative Aptitude,
CA CPT QT,A parameter is a characteristic of,Population,Sample,Both (a) and (b),(a) or (b),1,2,Sampling Theory,Quatitative Aptitude,
CA CPT QT,A statistic is,A function of sample observations,A function of population units,A characteristic of a population,A part of a population.,1,2,Sampling Theory,Quatitative Aptitude,
CA CPT QT,Which sampling provides separate estimates for population means for different segmentsand also an over all estimate?,Multistage sampling,Stratified sampling,Simple random sampling,Systematic sampling,2,2,Sampling Theory,Quatitative Aptitude,
CA CPT QT,Which sampling adds flexibility to the sampling process?,Simple random sampling,Multistage sampling,Stratified sampling,Systematic sampling,4,2,Sampling Theory,Quatitative Aptitude,
CA CPT QT,Which sampling is affected most if the sampling frame contains an undetected periodicity?,Simple random sampling,Stratified sampling,Multistage sampling,Systematic sampling,4,2,Sampling Theory,Quatitative Aptitude,
CA CPT QT,Which sampling is subjected to the discretion of the sampler?,Systematic sampling,Simple random sampling,Purposive sampling,Quota sampling.,3,2,Sampling Theory,Quatitative Aptitude,
CA CPT QT,The criteria for an ideal estimator are,"Unbiasedness, consistency, efficiency and sufficiency","Unbiasedness, expectation, sampling and estimation","Estimation, consistency, sufficiency and efficiency","Estimation, expectation, unbiasedness and sufficiency.",1,2,Sampling Theory,Quatitative Aptitude,
CA CPT QT,The sample standard deviation is,A biased estimator,An unbiased estimator.,A biased estimator for population SD,A biased estimator for population variance.,3,2,Sampling Theory,Quatitative Aptitude,
CA CPT QT,The sample mean is,An MVUE for population mean,A consistent and efficient estimator for population mean,A sufficient estimator for population mean,All of these.,4,2,Sampling Theory,Quatitative Aptitude,
CA CPT QT,"For an unknown parameter, how many interval estimates exist?",Only one,Two,Three,Many,4,2,Sampling Theory,Quatitative Aptitude,
CA CPT QT,The most commonly used confidence interval is,95 percent,90 percent,94 percent,98 percent.,1,2,Sampling Theory,Quatitative Aptitude,
CA CPT QT,"If a random sample of size 2 with replacement is taken from the population containingthe units 3,6 and 1, then the samples would be","(3,6),(3,1),(6,1)","(3,3),(6,6),(1,1)","(3,3),(3,6),(3,1),(6,6),(6,3),(6,1),(1,1),(1,3),(1,6)","(1,1),(1,3),(1,6),(6,1),(6,2),(6,3),(6,6),(1,6),(1,1)",3,2,Sampling Theory,Quatitative Aptitude,
CA CPT QT,"If a random sample of size two is taken without replacement from a population containingthe units a,b,c and d then the possible samples are","(a, b),(a, c),(a, d)","(a, b),(b, c), (c, d)","(a, b), (b, a), (a, c),(c,a), (a, d), (d, a)","(a, b), (a, c), (a, d), (b, c), (b, d), (c,d)",4,2,Sampling Theory,Quatitative Aptitude,
CA CPT QT,"If a random sample of 500 oranges produces 25 rotten arranges, then the estimate of SEof the proportion of rotten arranges in the sample is",0.01,0.05,0.028,0.0593,1,2,Sampling Theory,Quatitative Aptitude,
CA CPT QT,"If the population SD is known to be 5 for a population containing 80 units, then thestandard error of sample mean for a sample of size 25 without replacement is",5,0.2,1,0.83,4,2,Sampling Theory,Quatitative Aptitude,
CA CPT QT,A simple random sample of size 16 is drawn from a population with 50 members. Whatis the SE of sample mean if the population variance is known to be 25 given that thesampling is done with replacement?,1.25,6.25,1.04,1.56,1,2,Sampling Theory,Quatitative Aptitude,
CA CPT QT,"A simple random sample of size 10 is drawn without replacement from a universecontaining 85 units. If the mean and SD, as obtained from the sample, are 90 and 4respectively, what is the estimate of the standard error of sample mean?",0.58,1.27,0.67,0.72,2,2,Sampling Theory,Quatitative Aptitude,
CA CPT QT,"A sample of size 3 is taken from a population of 10 members with replacement. If thesample observations are 1,3 and 5, what is the estimate of the standard error of samplemean?",1.96,2,2.25,2.28,2,2,Sampling Theory,Quatitative Aptitude,
CA CPT QT,"If n numbers are drawn at random without replacement from the set { 1,2,..,m}, then var.(x) would be",(m+1) (mn)/12n,(m-1) (m+ n)/12n,(m-1) (m +n)/12n,(m-1) (m+n) / 12n,1,2,Sampling Theory,Quatitative Aptitude,
CA CPT QT,A random sample of the heights of 100 students from a large population of studentshaving SD as 0.35m show an average height of 1.75m. What are the 95% confidencelimits for the average height of all the students forming the population?,"[1.68 m , 1.82 m]","[1.58 m , 1.90 m ]","[1.58m, 1.92m]","[1.5m, 2.0m]",3,2,Sampling Theory,Quatitative Aptitude,
CA CPT QT,"A random sample of size 17 has 52 as mean. The sum of squares of deviation from meanis 160. The 99% confidence limits for the mean are[Given t 0.01,15= 2.60, t0.01,16= 2.58 t0.01,17= 2.57 t0.005,15= 2.95 t0.005,16= 2.92 t0.05,17= 2.90]","[43,6]","[45,59]","[42.77, 61.23]","[48,56]",3,2,Sampling Theory,Quatitative Aptitude,
CA CPT QT,A random sample of size 82 was taken to estimate the mean annual income of 500 familiesand the mean and SD were found to be Rs.7500 and Rs.80 respectively. What is upperconfidence limit to the average income of all the families when the confidence level is 90percent?[GivenΦ(2.58) = 0.95],"Rs. 7,600","Rs. 7,582","Rs. 7,520.98","Rs. 7,522.93",3,2,Sampling Theory,Quatitative Aptitude,
CA CPT QT,"8 Life Insurance Policies in a sample of 100 taken out of 20,000 policies were found to beinsured for less than Rs.10,000. How many policies in the whole lot can be expected to beinsured for less than Rs. 10,000 at 95% confidence level?",1050 and 2150,1058 and 2142,1040 and 2160,1023 and 2057,2,2,Sampling Theory,Quatitative Aptitude,
