course_name,question_desc,option_a,option_b,option_c,option_d,correct_option,difficulty_level,chapter_name,subject_name,
CA CPT QT,The two regression lines are 7x  3y  18 = 0 and 4x  y  11 = 0. Find the values of b<SUB><SMALL>yx</SMALL></SUB> and b<SUB><SMALL>xy</SMALL></SUB>,"7/3, ¼","-7/3 , -1/4"," 3/7, - ¼",None of these,1,2,Correlation And Regression,Quatitative Aptitude,
CA CPT QT,"'P' is the simple correlation coefficient, the quantity P<SUP><SMALL>2</SMALL></SUP> is known as:",Coefficient of determination,Coefficient of Nondetermination,Coefficient of alienation,None of the above,1,2,Correlation And Regression,Quatitative Aptitude,
CA CPT QT,,Combined mean,Harmonic mean,Geometric mean,Arithmetic mean,4,2,Correlation And Regression,Quatitative Aptitude,
CA CPT QT,"If the correlation coefficient between x and y is r then between <IMG alt="""" src=""C:\Documents and Settings\harshals\Desktop\Debug\AppImages\12 Correlation-1_image018_0000.png"">is",r,-r,(r-5)/2,( r 7)/10,1,2,Correlation And Regression,Quatitative Aptitude,
CA CPT QT,If two lines of regression are x + 2y  5 = 0 and 2x + 3y  8 = 0.<BR>The regression line of y on x is,x + 2y  5 = 0,2x + 3y -8 = 0,Any of the two lines,None of the two lines,1,2,Correlation And Regression,Quatitative Aptitude,
CA CPT QT,"If the sum of the product of deviations of x and y series from their means is zero, then the coefficient of correlation will be",1,-1,0,None of these,3,2,Correlation And Regression,Quatitative Aptitude,
CA CPT QT,The rank of five participants given by two judges are <TABLE border=1 cellSpacing=0 cellPadding=0 width=511> <TBODY> <TR> <TD vAlign=top width=511 colSpan=6> <P>&nbsp;&nbsp;&nbsp;&nbsp;&nbsp;&nbsp;&nbsp;&nbsp;&nbsp;&nbsp;&nbsp;&nbsp;&nbsp;&nbsp;&nbsp;&nbsp;&nbsp;&nbsp;&nbsp;&nbsp;&nbsp;&nbsp;&nbsp;&nbsp;&nbsp;&nbsp;&nbsp;&nbsp;&nbsp;&nbsp;&nbsp;&nbsp;&nbsp;&nbsp;&nbsp;&nbsp;&nbsp;&nbsp;&nbsp;&nbsp;&nbsp;&nbsp;&nbsp;&nbsp;&nbsp;&nbsp;&nbsp;&nbsp;&nbsp;&nbsp;&nbsp;&nbsp;&nbsp;&nbsp;&nbsp;&nbsp;&nbsp;&nbsp;&nbsp;&nbsp; Participants</P></TD></TR> <TR> <TD vAlign=top width=79> <P>&nbsp;</P></TD> <TD vAlign=top width=78> <P align=center>A</P></TD> <TD vAlign=top width=84> <P align=center>B</P></TD> <TD vAlign=top width=96> <P align=center>C</P></TD> <TD vAlign=top width=84> <P align=center>D</P></TD> <TD vAlign=top width=90> <P align=center>E</P></TD></TR> <TR> <TD vAlign=top width=79> <P>Judge 1</P></TD> <TD vAlign=top width=78> <P align=center>1</P></TD> <TD vAlign=top width=84> <P align=center>2</P></TD> <TD vAlign=top width=96> <P align=center>3</P></TD> <TD vAlign=top width=84> <P align=center>4</P></TD> <TD vAlign=top width=90> <P align=center>5</P></TD></TR> <TR> <TD vAlign=top width=79> <P>Judge 2</P></TD> <TD vAlign=top width=78> <P align=center>5</P></TD> <TD vAlign=top width=84> <P align=center>4</P></TD> <TD vAlign=top width=96> <P align=center>3</P></TD> <TD vAlign=top width=84> <P align=center>2</P></TD> <TD vAlign=top width=90> <P align=center>1</P></TD></TR></TBODY></TABLE><BR>Rank correlation coefficient between ranks will be,1,0, 1,½,3,2,Correlation And Regression,Quatitative Aptitude,
CA CPT QT,Regression coefficients are -------------,dependent of change of origin and of scale,independent of both change of orgin and of scale&nbsp;,dependent of change of origin but not of scale,independent of change of origin but not of scale,4,2,Correlation And Regression,Quatitative Aptitude,
CA CPT QT,Given: <img>12 Correlation-1_image062.png</img> <br> The coefficient of correlation between x and y is 0.6. What will be the regression coefficient of 'x' on 'y'?,0.03,0.3,0.2,0.05,2,2,Correlation And Regression,Quatitative Aptitude,
CA CPT QT,If the two lines of regression are x + 2y  5 = 0 and 2x + 3y  8 = 0. <BR>The regression line of y on x is,x + 2y  5 = 0,2x + 3y  8 = 0,Any of the two line,None of the two lines,3,2,Correlation And Regression,Quatitative Aptitude,
CA CPT QT,The covariance between two variables X and Y is 8.4 and their variances are 25 and 36 respectively. Calculate Karl Pearson's coefficient of correlation between them.,0.82,0.28,0.01,0.09,2,2,Correlation And Regression,Quatitative Aptitude,
CA CPT QT,"For a bivariate data, two times of regression are 40x  18y = 214 and 8x  10y + 66 = 0 then find the values of x and y",17 and 13,13 and 17,13 and  17, 13 and 17,2,2,Correlation And Regression,Quatitative Aptitude,
CA CPT QT,"Three competitors in a contest are ranked by two judges in the order 1, 2, 3 and 2, 3, 1 respectively. Calculate the Spearman's rank correlation coefficient", 0.5,-0.8,0.5,0.8,1,2,Correlation And Regression,Quatitative Aptitude,
CA CPT QT,What is spurious correlation?,It is a bad relation between two variables.,It is very low correlation between two variables&nbsp;,It is the correlation between two variables having no causal relation.,It is a negative correlation.,3,2,Correlation And Regression,Quatitative Aptitude,
CA CPT QT,Scatter diagram is considered for measuring,Linear relationship between two variables,curvilinear relationship between two variables,Neither a) nor b),Both a) and b).,4,2,Correlation And Regression,Quatitative Aptitude,
CA CPT QT,"If the plotted points in a scatter diagram lie from upper left to lower right, then thecorrelation is",Positive,Zero,Negative,None of these.,3,2,Correlation And Regression,Quatitative Aptitude,
CA CPT QT,"If the plotted points in a scatter diagram are evenly distributed, then the correlation is",Zero,negetive&nbsp;,Positive,a) or b).,1,2,Correlation And Regression,Quatitative Aptitude,
CA CPT QT,"If all the plotted points in a scatter diagram lie on a single line, then the correlation is",Perfect positive,Prefect negetive,Both a) and b),Either a) or b).,4,2,Correlation And Regression,Quatitative Aptitude,
CA CPT QT,The correlation between shoe-size and intelligence is,Zero,Positive,Negative,None of these.,1,2,Correlation And Regression,Quatitative Aptitude,
CA CPT QT,The correlation between the speed of an automobile and the distance travelled by it after applying the brakes is,Negative,Zero,Positive,None of these.,1,2,Correlation And Regression,Quatitative Aptitude,
CA CPT QT,Scatter diagram helps us to,Find the nature correlation between two variables,Compute the extend of cerrelation between two variables,Obtain the mathematical relationship between two variables,Both (a) and (c).,1,2,Correlation And Regression,Quatitative Aptitude,
CA CPT QT,Pearson's correlation coefficient is used for finding,Correlation for any type of relation,Correlation for linear relation only,Correlation for curvilinear relation only,Both b) and c),2,2,Correlation And Regression,Quatitative Aptitude,
CA CPT QT,Product moment correlation coefficient is considered for,Finding the nature of correlation,Finding the amount of correlation,Both (a) and (b),Either (a) and (b).,3,2,Correlation And Regression,Quatitative Aptitude,
CA CPT QT,"If the value of correlation coefficient is positive, then the points in a scatter diagram tend to cluster",From lower left corner to upper right corner,From lower left corner to&nbsp;lower right corner,From lower right corner to upper left corner,From lower right corner to upper right corner.,1,2,Correlation And Regression,Quatitative Aptitude,
CA CPT QT,"When&nbsp;v = 1, all the points in a scatter diagram would lie",On a straight line directed from lower left to upper right,On a straight line directed from lower left to lower&nbsp;right,On a straight line,Both a) and b).,1,2,Correlation And Regression,Quatitative Aptitude,
CA CPT QT,Product moment correlation coefficient may be defined as the ratio of,The product of standard deviations of the two variables to the covariance between them,The covariance between the variables to the product of the varince of them,The covariance between the variables to the product of their standard deviations,Either b) or c).,3,2,Correlation And Regression,Quatitative Aptitude,
CA CPT QT,The covariance between two variables is,Strictly positive,Strictly negative,Always 0,Either positive or negative or zero.,4,2,Correlation And Regression,Quatitative Aptitude,
CA CPT QT,The coefficient of correlation between two variables,Can have any unit.,is&nbsp;expressed as rhe product of units of two vriables,Is a unit free measure,None of these.,3,2,Correlation And Regression,Quatitative Aptitude,
CA CPT QT,What are the limits of the correlation coefficient?,No limit,-1 and 1,"0 and 1, including the limits","-1 and 1, including the limits",3,2,Correlation And Regression,Quatitative Aptitude,
CA CPT QT,"In case the correlation coefficient between two variables is 1, the relationship between the two variables would be",y = a + bx,"y = a + bx, b &gt; 0","y = a + bx, b &lt; 0","y = a + bx, both a and b being positive.",2,2,Correlation And Regression,Quatitative Aptitude,
CA CPT QT,Bivariate Data are the data collected for,Two variables,More than Two variables,Two variables at the same point of time,Two variables at different points of time.,3,2,Correlation And Regression,Quatitative Aptitude,
CA CPT QT,For a bivariate frequency table having (p + q) classification the total number of cells is,p,p + q,q,pq,4,2,Correlation And Regression,Quatitative Aptitude,
CA CPT QT,Some of the cell frequencies in a bivariate frequency table may be,Negative,Zero,a or b,None of these,2,2,Correlation And Regression,Quatitative Aptitude,
CA CPT QT,"For a p x q bivariate frequency table, the maximum number of marginal distributions is",p,p + q&nbsp;&nbsp;,1,2,4,2,Correlation And Regression,Quatitative Aptitude,
CA CPT QT,"For a p x q classification of bivariate data, the maximum number of conditional distributionsis",p,p + q,pq,p or q,2,2,Correlation And Regression,Quatitative Aptitude,
CA CPT QT,Correlation analysis aims at,Predicting one variable for a given value of the other variable,Establising the relation between two variables,Measuring the extent of relation between two variables,Both b) and c).,4,2,Correlation And Regression,Quatitative Aptitude,
CA CPT QT,Regression analysis is concerned with,Establishing a mathematical relationship between two variables,Measuring the extent of relation between two variables,Predicting the value of the dependent variable for a given value of the independent variable,Both a) and c).,4,2,Correlation And Regression,Quatitative Aptitude,
CA CPT QT,"If the relationship between two variables x and y in given by 2x + 3y + 4 = 0, then thevalue of the correlation coefficient between x and y is",0,1,1,negative.,3,2,Correlation And Regression,Quatitative Aptitude,
CA CPT QT,"For finding correlation between two attributes, we consider",Pearson's correlation coefficient,Scatter diagram,Spearman's rank correlation coefficient,Coefficient of concurrent deviations.,3,2,Correlation And Regression,Quatitative Aptitude,
CA CPT QT,"For finding the degree of agreement about beauty between two Judges in a Beauty Contest, we use",Scatter diagram,Coefficient of rank&nbsp;correlation,Coefficient of correlation,Coefficient of concurrent deviation.,2,2,Correlation And Regression,Quatitative Aptitude,
CA CPT QT,"If there is a perfect disagreement between the marks in Geography and Statistics, thenwhat would be the value of rank correlation coefficient?",Any value,only 1,Only -1,b) or c),3,2,Correlation And Regression,Quatitative Aptitude,
CA CPT QT,"When we are not concerned with the magnitude of the two variables under discussion, we consider",Rank correlation coefficient,Product moment correlation coeffienent,Coefficient of concurrent deviation,a) or b) but not c),3,2,Correlation And Regression,Quatitative Aptitude,
CA CPT QT,What is the quickest method to find correlation between two variables?,Scatter diagram,Method of concurrent deviation,Method of rank correlation,Method of product moment correlation,2,2,Correlation And Regression,Quatitative Aptitude,
CA CPT QT,What are the limits of the coefficient of concurrent deviations?,No limit,"Between&nbsp;-1 and 0, including the limiting values","Between 0 and 1, including the limiting values","Between -1 and 1, the limiting values inclusive",4,2,Correlation And Regression,Quatitative Aptitude,
CA CPT QT,"If there are two variables x and y, then the number of regression equations could be",1,2,Any number,3,2,2,Correlation And Regression,Quatitative Aptitude,
CA CPT QT,"Since Blood Pressure of a person depends on age, we need consider",The regression equation of Blood Pressure on age,The regression equation of age of blood pressure,Both a) and b),Either a) or b).,1,2,Correlation And Regression,Quatitative Aptitude,
CA CPT QT,The method applied for deriving the regression equations is known as,Least squares,concurrent deviation,Product moment,Normal equation.,1,2,Correlation And Regression,Quatitative Aptitude,
CA CPT QT,The difference between the observed value and the estimated value in regression analysis is known as,Error,residue,Deviation,a) or b).,4,2,Correlation And Regression,Quatitative Aptitude,
CA CPT QT,The errors in case of regression equations are,Positive,Negative,Zero,All these.,4,2,Correlation And Regression,Quatitative Aptitude,
CA CPT QT,The regression line of y on is derived by,The minimisation of vertical distances in the scatter diagram,The minimisation of&nbsp;horizontal distances in the scatter diagram,Both a) and b),a) or b).,1,2,Correlation And Regression,Quatitative Aptitude,
CA CPT QT,The two lines of regression become identical when,r = 1,r = -1,r = 0,a) or b).,4,2,Correlation And Regression,Quatitative Aptitude,
CA CPT QT,What are the limits of the two regression coefficients?,No limit,must be positive,One positive and the other negative,Product of the regression coefficient must be numerically less than unity.,4,2,Correlation And Regression,Quatitative Aptitude,
CA CPT QT,The regression coefficients remain unchanged due to a,Shift of origin,Shift of Scale,Both a) and b),a) or b).,1,2,Correlation And Regression,Quatitative Aptitude,
CA CPT QT,"If the coefficient of correlation between two variables is ° 9, then the coefficient of determination is",0.9,0.81,0.1,0.19.,2,2,Correlation And Regression,Quatitative Aptitude,
CA CPT QT,If the coefficient of correlation between two variables is 0.7 then the percentage of variation unaccounted for is,70%,30%,51%,49%,3,2,Correlation And Regression,Quatitative Aptitude,
CA CPT QT,"If for two variable x and y, the covariance, variance of x and variance of y are 40, 16 and256 respectively, what is the value of the correlation coefficient?",0.01,0.625,0.4,0.5,2,2,Correlation And Regression,Quatitative Aptitude,
CA CPT QT,"If cov(x, y) = 15, what restrictions should be put for the standard deviations of x and y?",No restriction.,The product of the standard deviations should be&nbsp;more than 15,The product of the standard deviations should be less than 15.,The sum of the standard deviations should be less than 15.,2,2,Correlation And Regression,Quatitative Aptitude,
CA CPT QT,"If the covariance between two variables is 20 and the variance of one of the variables is 16,what would be the variance of the other variable?",More than 100,more than 10,Less than 10,More than 1.25,1,2,Correlation And Regression,Quatitative Aptitude,
CA CPT QT,"If y = a + bx, then what is the coefficient of correlation between x and y?",1,-1,1 or -1 according as b &gt; 0 or b &lt; 0,none of these.,3,2,Correlation And Regression,Quatitative Aptitude,
CA CPT QT,If r = 0.6 then the coefficient of non-determination is,0.4,-0.6,0.36,0.64,4,2,Correlation And Regression,Quatitative Aptitude,
CA CPT QT,If u + 5x = 6 and 3y  7v = 20 and the correlation coefficient between x and y is 0.58 thenwhat would be the correlation coefficient between u and v?,0.58,-0.58,-0.84,0.84,2,2,Correlation And Regression,Quatitative Aptitude,
CA CPT QT,"If the relation between x and u is 3x + 4u + 7 = 0 and the correlation coefficient between xand y is -0.6, then what is the correlation coefficient between u and y?",-0.6,0.8,0.6,-0.8,3,2,Correlation And Regression,Quatitative Aptitude,
CA CPT QT,From the following data: <TABLE border=1 cellSpacing=0 cellPadding=1> <TBODY> <TR> <TD vAlign=top width=106> <P>x</P></TD> <TD vAlign=top width=106> <P>2</P></TD> <TD vAlign=top width=106> <P>3</P></TD> <TD vAlign=top width=106> <P>5</P></TD> <TD vAlign=top width=106> <P>4</P></TD> <TD vAlign=top width=106> <P>7</P></TD></TR> <TR> <TD vAlign=top width=106> <P>y</P></TD> <TD vAlign=top width=106> <P>4</P></TD> <TD vAlign=top width=106> <P>6</P></TD> <TD vAlign=top width=106> <P>7</P></TD> <TD vAlign=top width=106> <P>8</P></TD> <TD vAlign=top width=106> <P>10</P></TD></TR></TBODY></TABLE>Two coefficient of correlation was found to be 0.93. What is the correlation between u and v as given below? <TABLE border=1 cellSpacing=0 cellPadding=1> <TBODY> <TR> <TD vAlign=top width=106> <P>u</P></TD> <TD vAlign=top width=106> <P>-3</P></TD> <TD vAlign=top width=106> <P>-2</P></TD> <TD vAlign=top width=106> <P>0</P></TD> <TD vAlign=top width=106> <P>-1</P></TD> <TD vAlign=top width=106> <P>2</P></TD></TR> <TR> <TD vAlign=top width=106> <P>v</P></TD> <TD vAlign=top width=106> <P>-4</P></TD> <TD vAlign=top width=106> <P>-2</P></TD> <TD vAlign=top width=106> <P>-1</P></TD> <TD vAlign=top width=106> <P>0</P></TD> <TD vAlign=top width=106> <P>10</P></TD></TR></TBODY></TABLE>,-0.93,0.93,0.57,-0.57,2,2,Correlation And Regression,Quatitative Aptitude,
CA CPT QT,"Referring to the data presented in Q. No. 8,what would be the correlation between u and v?<table border=""1"" cellspacing=""0"" cellpadding=""1""> <tr> <td width=""106"" valign=""top""><p>u</p></td> <td width=""106"" valign=""top""><p>10</p></td> <td width=""106"" valign=""top""><p>15</p></td> <td width=""106"" valign=""top""><p>25</p></td> <td width=""106"" valign=""top""><p>20</p></td> <td width=""106"" valign=""top""><p>35</p></td> </tr> <tr> <td width=""106"" valign=""top""><p>v</p></td> <td width=""106"" valign=""top""><p>-24</p></td> <td width=""106"" valign=""top""><p>-36</p></td> <td width=""106"" valign=""top""><p>-42</p></td> <td width=""106"" valign=""top""><p>-48</p></td> <td width=""106"" valign=""top""><p>-60</p></td> </tr> </table>",-0.6,0.6,-0.93,0.93,3,2,Correlation And Regression,Quatitative Aptitude,
CA CPT QT,"If the sum of squares of difference of ranks, given by two judges A and B, of 8 students in21, what is the value of rank correlation coefficient?",0.7,0.65,0.75,0.8,3,2,Correlation And Regression,Quatitative Aptitude,
CA CPT QT,"If the rank correlation coefficient between marks in management and mathematics for agroup of student in 0.6 and the sum of squares of the differences in ranks in 66, what isthe number of students in the group?",10,9,8,11,1,2,Correlation And Regression,Quatitative Aptitude,
CA CPT QT,While computing rank correlation coefficient between profit and investment for the last 6years of a company the difference in rank for a year was taken 3 instead of 4. What is therectified rank correlation coefficient if it is known that the original value of rank correlationcoefficient was 0.4?,0.3,0.2,0.25,0.28,2,2,Correlation And Regression,Quatitative Aptitude,
CA CPT QT,"For 10 pairs of observations, No. of concurrent deviations was found to be 4. What is thevalue of the coefficient of concurrent deviation?",√(0.2),,(1/3),(-1/3),4,2,Correlation And Regression,Quatitative Aptitude,
CA CPT QT,"The coefficient of concurrent deviation for p pairs of observations was found to be 1/&#8730;3. If the number of concurrent deviations was found to be 6, then the value of p is.",10,9,8,none of these,1,2,Correlation And Regression,Quatitative Aptitude,
CA CPT QT,"What is the value of correlation coefficient due to Pearson on the basis of the following data:<table border=""1"" cellspacing=""0"" cellpadding=""1""> <tr> <td width=""53"" valign=""top""><p>X:</p></td> <td width=""53"" valign=""top""><p>-5</p></td> <td width=""53"" valign=""top""><p>-4</p></td> <td width=""53"" valign=""top""><p>-3</p></td> <td width=""53"" valign=""top""><p>-2</p></td> <td width=""53"" valign=""top""><p>-1 </p></td> <td width=""53"" valign=""top""><p>0</p></td> <td width=""53"" valign=""top""><p>1 </p></td> <td width=""53"" valign=""top""><p>2 </p></td> <td width=""53"" valign=""top""><p>3</p></td> <td width=""53"" valign=""top""><p>4</p></td> <td width=""53"" valign=""top""><p>5</p></td> </tr> <tr> <td width=""53"" valign=""top""><p>Y:</p></td> <td width=""53"" valign=""top""><p>27</p></td> <td width=""53"" valign=""top""><p>18</p></td> <td width=""53"" valign=""top""><p>11</p></td> <td width=""53"" valign=""top""><p>6</p></td> <td width=""53"" valign=""top""><p>3</p></td> <td width=""53"" valign=""top""><p>2</p></td> <td width=""53"" valign=""top""><p>3</p></td> <td width=""53"" valign=""top""><p>6</p></td> <td width=""53"" valign=""top""><p>11</p></td> <td width=""53"" valign=""top""><p>18</p></td> <td width=""53"" valign=""top""><p>27</p></td> </tr> </table>",1,-1,0,-0.5,3,2,Correlation And Regression,Quatitative Aptitude,
CA CPT QT,Following are the two normal equations obtained for deriving the regression line ofy and x:5a + 10b = 4010a + 25b = 95The regression line of y on x is given by,2x + 3y = 5,2y + 3x = 5,y = 2 + 3x,y = 3 + 5x,3,2,Correlation And Regression,Quatitative Aptitude,
CA CPT QT,"If the regression line of y on x and of x on y are given by 2x + 3y = 1 and 5x + 6y =&nbsp;-1, then the arithmetic means of x and y are given by","(1, -1)","(-1 , 1)","(-1, -1)","(2, 3)",1,2,Correlation And Regression,Quatitative Aptitude,
CA CPT QT,"Given the regression equations as 3x + y = 13 and 2x + 5y = 20, which one is the regressionequation of y on x?",1st equation,2nd equation,both a) and b),none of these,2,2,Correlation And Regression,Quatitative Aptitude,
CA CPT QT,"Given the following equations: 2x  3y = 10 and 3x + 4y = 15, which one is the regression equation of x on y ?",1st equation,2nd equation,both the equations,none of these,4,2,Correlation And Regression,Quatitative Aptitude,
CA CPT QT,"If u = 2x + 5 and v = 3y  6 and regression coefficient of y on x is 2.4, what is the regression coefficient of v on u?",3.6,-3.6,2.4,-2.4,2,2,Correlation And Regression,Quatitative Aptitude,
CA CPT QT,"If 4y  5x = 15 is the regression line of y on x and the coefficient of correlation between xand y is 0.75, what is the value of the regression coefficient of x on y?",0.45,0.9375,0.6,none of these,1,2,Correlation And Regression,Quatitative Aptitude,
CA CPT QT,"If the regression line of y on x and that of x on y are given by y = 2x + 3 and 8x = y + 3respectively, what is the coefficient of correlation between x and y?",0.5,,0.5,none of these,3,2,Correlation And Regression,Quatitative Aptitude,
CA CPT QT,"If the regression coefficient of y on x, the coefficient of correlation between x and y and variance of y are (-3/4),-(-(√3)/2) and 4 respectively, what is the variance of x?",2/(√3)/2)&nbsp;&nbsp;&nbsp;,3/16/2016,4/3/2016,4,2,2,Correlation And Regression,Quatitative Aptitude,
CA CPT QT,"If y = 3x + 4 is the regression line of y on x and the arithmetic mean of x is -1, what is the arithmetic mean of y?",1,-1,7,none of these,1,2,Correlation And Regression,Quatitative Aptitude,
CA CPT QT,"What is the coefficient of correlation from the following data? <table border=""1"" cellspacing=""0"" cellpadding=""1""> <tr> <td width=""106"" valign=""top""><p>x</p></td> <td width=""106"" valign=""top""><p>1</p></td> <td width=""106"" valign=""top""><p>2</p></td> <td width=""106"" valign=""top""><p>3</p></td> <td width=""106"" valign=""top""><p>4</p></td> <td width=""106"" valign=""top""><p>5</p></td> </tr> <tr> <td width=""106"" valign=""top""><p>Y</p></td> <td width=""106"" valign=""top""><p>8</p></td> <td width=""106"" valign=""top""><p>6</p></td> <td width=""106"" valign=""top""><p>7</p></td> <td width=""106"" valign=""top""><p>5</p></td> <td width=""106"" valign=""top""><p>5</p></td> </tr> </table>",0.75,-0.75,-0.85,0.82,3,2,Correlation And Regression,Quatitative Aptitude,
CA CPT QT,The coefficient of correlation between x and y where: <TABLE border=1 cellSpacing=0 cellPadding=1> <TBODY> <TR> <TD vAlign=top width=106> <P>x</P></TD> <TD vAlign=top width=106> <P>64</P></TD> <TD vAlign=top width=106> <P>60</P></TD> <TD vAlign=top width=106> <P>67</P></TD> <TD vAlign=top width=106> <P>59</P></TD> <TD vAlign=top width=106> <P>69</P></TD></TR> <TR> <TD vAlign=top width=106> <P>Y</P></TD> <TD vAlign=top width=106> <P>57</P></TD> <TD vAlign=top width=106> <P>60</P></TD> <TD vAlign=top width=106> <P>73</P></TD> <TD vAlign=top width=106> <P>62</P></TD> <TD vAlign=top width=106> <P>68</P></TD></TR></TBODY></TABLE>is,0.655,0.68,0.73,0.758,1,2,Correlation And Regression,Quatitative Aptitude,
